{
  "$schema": "https://json-schema.org/draft/2020-12/schema",
  "$id": "https://raw.githubusercontent.com/fctaityo/lf-codex-sync/main/sync/schema/current.schema.json",
  "title": "LF CODEX Linkage Current Recovery Projection",
  "type": "object",
  "additionalProperties": false,
  "required": [
    "schema_version", "project_id", "snapshot_id", "generated_at", "source_sync_id",
    "source_internal_commit_sha", "supersedes_snapshot_id", "projection_state",
    "project", "active_work", "reference_implementations", "foundry_core", "ri4_hardening", "note_editorial", "recovery"
  ],
  "properties": {
    "schema_version": {"type": "string", "pattern": "^1(?:\\.[0-9]+)?$"},
    "project_id": {"type": "string", "const": "LOCAL-AI-FOUNDRY"},
    "snapshot_id": {"type": "string", "pattern": "^SYNC-PUBLIC-[A-Z0-9._-]+$"},
    "generated_at": {"type": "string", "format": "date-time"},
    "source_sync_id": {"type": "string", "minLength": 1, "maxLength": 128},
    "source_internal_commit_sha": {
      "type": "string",
      "pattern": "^[0-9a-fA-F]{40}$",
      "x-lf-content-class": "machine-identity"
    },
    "supersedes_snapshot_id": {
      "oneOf": [
        {"type": "null"},
        {"type": "string", "pattern": "^SYNC-PUBLIC-[A-Z0-9._-]+$"}
      ]
    },
    "projection_state": {
      "type": "string",
      "enum": ["FORMAL_LAST_SYNCHRONIZED_CURRENT", "PUBLIC_RECOVERY_PENDING", "STALE"]
    },
    "project": {
      "type": "object",
      "additionalProperties": false,
      "required": [
        "project_state", "active_baseline", "current_phase", "current_vector",
        "project_next_action", "project_required_human_decision"
      ],
      "properties": {
        "project_state": {"type": "string", "minLength": 1, "maxLength": 128},
        "active_baseline": {"type": "string", "minLength": 1, "maxLength": 128},
        "current_phase": {"type": "string", "minLength": 1, "maxLength": 256},
        "current_vector": {"type": "string", "minLength": 1, "maxLength": 512},
        "project_next_action": {"type": ["string", "null"], "maxLength": 1024},
        "project_required_human_decision": {"type": ["string", "null"], "maxLength": 1024}
      }
    },
    "active_work": {
      "type": "object",
      "additionalProperties": false,
      "required": [
        "initiative", "status", "completed_checkpoint", "initiative_next_action",
        "blocker", "initiative_human_decision"
      ],
      "properties": {
        "initiative": {"type": "string", "minLength": 1, "maxLength": 256},
        "status": {"type": "string", "minLength": 1, "maxLength": 256},
        "completed_checkpoint": {"type": ["string", "null"], "maxLength": 2048},
        "initiative_next_action": {"type": ["string", "null"], "maxLength": 1024},
        "blocker": {"type": ["string", "null"], "maxLength": 1024},
        "initiative_human_decision": {"type": ["string", "null"], "maxLength": 1024}
      }
    },
    "reference_implementations": {
      "type": "array",
      "maxItems": 100,
      "items": {
        "type": "object",
        "additionalProperties": false,
        "required": ["id", "domain", "public_name", "current_role", "implementation_state", "acceptance", "current_implementation"],
        "properties": {
          "id": {"type": "string", "pattern": "^RI#[0-9]+$"},
          "domain": {"type": "string", "minLength": 1, "maxLength": 256},
          "public_name": {"type": "string", "minLength": 1, "maxLength": 256},
          "current_role": {"type": "string", "minLength": 1, "maxLength": 256},
          "implementation_state": {"type": "string", "minLength": 1, "maxLength": 256},
          "acceptance": {"type": ["string", "null"], "maxLength": 256},
          "current_implementation": {"type": ["string", "null"], "maxLength": 256}
        }
      }
    },
    "foundry_core": {
      "type": "object",
      "additionalProperties": false,
      "required": ["confirmed_core", "current_development_phase"],
      "properties": {
        "confirmed_core": {
          "type": "array",
          "maxItems": 100,
          "items": {
            "type": "object",
            "additionalProperties": false,
            "required": ["id", "name", "status"],
            "properties": {
              "id": {"type": "string", "pattern": "^FC-CORE-[0-9]{3}$"},
              "name": {"type": "string", "maxLength": 256},
              "status": {"type": "string", "enum": ["CORE CONFIRMED"]}
            }
          }
        },
        "current_development_phase": {"type": ["string", "null"], "maxLength": 512}
      }
    },
    "ri4_hardening": {
      "type": "object",
      "additionalProperties": false,
      "required": ["campaign", "campaign_state", "canonical_final", "machine_closure", "article_quality_baseline", "next_milestone", "open_failure_families", "ri5_protection", "production_acceptance", "production_binding"],
      "properties": {
        "campaign": {"const": "AQC-01"},
        "campaign_state": {"type": "string", "minLength": 1, "maxLength": 256},
        "canonical_final": {"type":"object","additionalProperties":false,"required":["filename","sha256"],"properties":{"filename":{"type":"string","minLength":1},"sha256":{"type":"string","pattern":"^[0-9A-F]{64}$","x-lf-content-class":"machine-identity"}}},
        "machine_closure": {"const":"SATISFIED"},
        "article_quality_baseline": {"enum": ["NOT_ESTABLISHED", "SEEDING", "MEASURED", "HARDENING", "STABLE_CANDIDATE"]},
        "next_milestone": {"const": "ARTICLE QUALITY BASELINE"},
        "open_failure_families": {"type": "array", "minItems": 3, "maxItems": 32, "items": {"type": "string", "pattern": "^FF-[A-Z]{2}-[0-9]{3}$"}},
        "ri5_protection": {"const": "PROTECTED_BASE"},
        "production_acceptance": {"const": "NOT REACHED"},
        "production_binding": {"const": "UNCHANGED"}
      }
    },
    "note_editorial": {
      "type": "object",
      "additionalProperties": false,
      "required": [
        "canonical_entry", "current_state", "public_canonical_commit_sha",
        "series_baseline_authority", "series_baseline_projection", "static_gate"
      ],
      "properties": {
        "canonical_entry": {"const": "notes/editorial/note-publication-contract.md"},
        "current_state": {"const": "SERIES STRUCTURAL BASELINE MACHINE-GATED"},
        "public_canonical_commit_sha": {"type": "string", "pattern": "^[0-9a-f]{40}$", "x-lf-content-class": "machine-identity"},
        "series_baseline_authority": {"const": "HUMAN ACCEPTED ARTICLE"},
        "series_baseline_projection": {"const": "notes/editorial/series-structure-baseline.json"},
        "static_gate": {"const": "scripts/note_publication_lint.py"}
      }
    },
    "paid_pdf": {
      "type": "object",
      "additionalProperties": false,
      "required": [
        "production_standard", "page_isolation", "patch_escalation",
        "visual_baseline_registry", "pptx_editable_source", "full_page_raster_pptx",
        "image_asset_boundary", "pptx_pdf_pair", "typography_authority",
        "canonical_authority", "source_binding",
        "projection_integrity"
      ],
      "properties": {
        "production_standard": {"type": "string", "const": "CURRENT / HUMAN-APPROVED VISUAL-FIRST"},
        "page_isolation": {"type": "string", "const": "TARGET PAGE EDITABLE / NON-TARGET PAGES FROZEN"},
        "patch_escalation": {"type": "string", "const": "AFTER TWO CONSECUTIVE HUMAN ACCEPTANCE FAILURES: LOCAL UNIT OR TARGET PAGE RECONSTRUCTION"},
        "visual_baseline_registry": {"type": "string", "const": "CURRENT / HUMAN ACCEPTANCE AUTHORITY"},
        "pptx_editable_source": {"type": "string", "const": "REQUIRED / EDITABLE POWERPOINT OBJECTS"},
        "full_page_raster_pptx": {"type": "string", "const": "PROHIBITED"},
        "image_asset_boundary": {"type": "string", "const": "ILLUSTRATION / DECORATION / PHOTO ONLY; PRIMARY INFORMATION REMAINS EDITABLE"},
        "pptx_pdf_pair": {"type": "string", "const": "PPTX EDITABLE SOURCE → PDF EXPORT → VISUAL VERIFICATION"},
        "typography_authority": {"type": "string", "const": "HUMAN ACCEPTED VISUAL BASELINE / NOTO SANS CJK JP CURRENT"},
        "canonical_authority": {"type": "string", "const": "INTERNAL ONLY / PUBLIC READ-ONLY PROJECTION"},
        "source_binding": {"type": "string", "const": "source_internal_commit_sha"},
        "projection_integrity": {"type": "string", "const": "sync/current.sha256"}
      }
    },
    "required_contracts": {
      "type": "array",
      "maxItems": 32,
      "items": {
        "type": "object",
        "additionalProperties": false,
        "required": ["contract_id", "applies_to", "projection_path", "integrity_path", "projection_sha256", "mandatory"],
        "properties": {
          "contract_id": {"type": "string", "minLength": 1, "maxLength": 128},
          "applies_to": {"type": "array", "items": {"type": "string", "minLength": 1, "maxLength": 128}},
          "projection_path": {"type": "string", "pattern": "^sync/contracts/[a-z0-9-]+\\.json$"},
          "integrity_path": {"type": "string", "pattern": "^sync/contracts/[a-z0-9-]+\\.sha256$"},
          "projection_sha256": {"type": "string", "pattern": "^[0-9a-f]{64}$", "x-lf-content-class": "machine-identity"},
          "mandatory": {"type": "boolean"}
        }
      }
    },
    "recovery": {
      "type": "object",
      "additionalProperties": false,
      "required": ["public_boundary_class", "source_scope", "recovery_level"],
      "properties": {
        "public_boundary_class": {"type": "string", "const": "CODEX-LINKAGE-PUBLIC-GIT-RECOVERY"},
        "source_scope": {"type": "string", "const": "INTERNAL_FORMAL_CURRENT"},
        "recovery_level": {"type": "string", "enum": ["R0"]}
      }
    }
  }
}
