{
  "active_work": {
    "blocker": "NONE",
    "completed_checkpoint": "RI#5 Evidence Foundation milestone reached through Actual Human Runtime traceability / terminal HOLD lifecycle machine closed",
    "initiative": "RI #5 Evidence Foundation Milestone / RI #4 Evidence-Driven Runtime Hardening",
    "initiative_human_decision": "Case 1 traceability confirmed / Production Acceptance not granted / Production Binding unchanged",
    "initiative_next_action": "v15 Canonical FINAL packaging closure is complete; AQC01-01 Human Reentry requires fresh Human GO; AQC01-02 must not start",
    "status": "RI5 EVIDENCE FOUNDATION MILESTONE REACHED / RI4 QUALITY FINDING OPEN（Project State Published、Active Baseline BL-20260801-001不変、Production Acceptance未付与）"
  },
  "foundry_core": {
    "confirmed_core": [
      {
        "id": "FC-CORE-001",
        "name": "Runtime Capability Calibration",
        "status": "CORE CONFIRMED"
      },
      {
        "id": "FC-CORE-002",
        "name": "Delegation Contract Binding",
        "status": "CORE CONFIRMED"
      },
      {
        "id": "FC-CORE-003",
        "name": "Deterministic Technical Gate",
        "status": "CORE CONFIRMED"
      },
      {
        "id": "FC-CORE-004",
        "name": "Evidence Traceability",
        "status": "CORE CONFIRMED"
      }
    ],
    "current_development_phase": "RI #5 EVIDENCE FOUNDATION → RI #4 EVIDENCE-DRIVEN RUNTIME HARDENING"
  },
  "generated_at": "2026-09-27T07:30:00+09:00",
  "note_editorial": {
    "canonical_entry": "notes/editorial/note-publication-contract.md",
    "current_state": "SERIES STRUCTURAL BASELINE MACHINE-GATED",
    "public_canonical_commit_sha": "0000000000000000000000000000000000000000",
    "series_baseline_authority": "HUMAN ACCEPTED ARTICLE",
    "series_baseline_projection": "notes/editorial/series-structure-baseline.json",
    "static_gate": "scripts/note_publication_lint.py"
  },
  "paid_pdf": {
    "canonical_authority": "INTERNAL ONLY / PUBLIC READ-ONLY PROJECTION",
    "full_page_raster_pptx": "PROHIBITED",
    "image_asset_boundary": "ILLUSTRATION / DECORATION / PHOTO ONLY; PRIMARY INFORMATION REMAINS EDITABLE",
    "page_isolation": "TARGET PAGE EDITABLE / NON-TARGET PAGES FROZEN",
    "patch_escalation": "AFTER TWO CONSECUTIVE HUMAN ACCEPTANCE FAILURES: LOCAL UNIT OR TARGET PAGE RECONSTRUCTION",
    "pptx_editable_source": "REQUIRED / EDITABLE POWERPOINT OBJECTS",
    "pptx_pdf_pair": "PPTX EDITABLE SOURCE → PDF EXPORT → VISUAL VERIFICATION",
    "production_standard": "CURRENT / HUMAN-APPROVED VISUAL-FIRST",
    "projection_integrity": "sync/current.sha256",
    "source_binding": "source_internal_commit_sha",
    "typography_authority": "HUMAN ACCEPTED VISUAL BASELINE / NOTO SANS CJK JP CURRENT",
    "visual_baseline_registry": "CURRENT / HUMAN ACCEPTANCE AUTHORITY"
  },
  "project": {
    "active_baseline": "BL-20260801-001",
    "current_phase": "RI #5 Evidence Foundation Milestone Reached / RI #4 Evidence-Driven Runtime Hardening",
    "current_vector": "RI #5 EVIDENCE FOUNDATION → RI #4 EVIDENCE-DRIVEN RUNTIME HARDENING",
    "project_next_action": "v15 Canonical FINAL packaging closure is complete; AQC01-01 Human Reentry requires fresh Human GO; AQC01-02 must not start",
    "project_required_human_decision": "Case 1 traceability confirmed / Production Acceptance not granted / Production Binding unchanged",
    "project_state": "Published"
  },
  "project_id": "LOCAL-AI-FOUNDRY",
  "projection_state": "FORMAL_LAST_SYNCHRONIZED_CURRENT",
  "recovery": {
    "public_boundary_class": "CODEX-LINKAGE-PUBLIC-GIT-RECOVERY",
    "recovery_level": "R0",
    "source_scope": "INTERNAL_FORMAL_CURRENT"
  },
  "reference_implementations": [
    {
      "acceptance": "Current Runtime Acceptance対象外",
      "current_implementation": "Historical Dify / Ollama / n8n / ComfyUI implementation",
      "current_role": "FROZEN / HISTORICAL BENCHMARK",
      "domain": "Article Production",
      "id": "RI#1",
      "implementation_state": "Historical Evidence Preserved",
      "public_name": "Article Production"
    },
    {
      "acceptance": "LIVE ACCEPTANCE PENDING",
      "current_implementation": "Documentation Production v0.34",
      "current_role": "CORE CONTRIBUTOR",
      "domain": "Documentation Production",
      "id": "RI#2",
      "implementation_state": "IMPLEMENTATION VERIFIED",
      "public_name": "Documentation Production"
    },
    {
      "acceptance": "PRODUCTION ACCEPTANCE NOT REACHED",
      "current_implementation": "FoundryConsole v0.49",
      "current_role": "RUNTIME VALIDATED / CORE CONTRIBUTOR",
      "domain": "Visual Asset Production",
      "id": "RI#3",
      "implementation_state": "Human-facing Control Surface / Current Implementation",
      "public_name": "Visual Asset Production"
    },
    {
      "acceptance": "PRODUCTION ACCEPTANCE NOT REACHED",
      "current_implementation": "Current Candidate v0.71",
      "current_role": "ACTIVE VALIDATION / EVIDENCE-DRIVEN RUNTIME HARDENING",
      "domain": "Research-Grounded Long-form Content Production",
      "id": "RI#4",
      "implementation_state": "AQC01-01 v15 Canonical FINAL machine-closed / pending fresh Human GO / Production Acceptance Not Granted",
      "public_name": "Research-Grounded Long-form Production"
    },
    {
      "acceptance": "CONTROL PLANE ACCEPTANCE PENDING",
      "current_implementation": "Current Candidate v1.0.2 / LF-EKB v0.3",
      "current_role": "EVIDENCE FOUNDATION MILESTONE / PROTECTED BASE",
      "domain": "Foundry Evidence / Control Plane",
      "id": "RI#5",
      "implementation_state": "Evidence Foundation milestone reached in Actual Human Runtime / protected base / Production Acceptance Not Reached",
      "public_name": "Evidence Foundation"
    }
  ],
  "required_contracts": [
    {
      "applies_to": [
        "RI5_IMPLEMENTATION",
        "RI5_VERIFICATION",
        "RI5_CANDIDATE_RELEASE",
        "RI5_HUMAN_RUNTIME_VERIFICATION",
        "SYNCHRONIZATION_CLOSURE"
      ],
      "contract_id": "LF-RI5-DEVELOPMENT-GATES",
      "integrity_path": "sync/contracts/ri5-development-gates.sha256",
      "mandatory": true,
      "projection_path": "sync/contracts/ri5-development-gates.json",
      "projection_sha256": "8456b5c6c4ed94d30b5175364462ad1db551d1098189cc21516dfd33e8a8b0c9"
    }
  ],
  "ri4_hardening": {
    "article_quality_baseline": "NOT_ESTABLISHED",
    "campaign": "AQC-01",
    "campaign_state": "AQC01-01 V15 CANONICAL FINAL MACHINE CLOSED / HUMAN RUNTIME PENDING FRESH HUMAN GO",
    "canonical_final": {
      "filename": "LF-RI5-v1.0.2-RI4-v0.71-AQC01-V15-IMPLEMENTATION-CANONICAL-FINAL-20260906.zip",
      "sha256": "08E7B9F4386080B0DA6E74CA1D34630DFC5FDAFC3EE01B2E958B15325D52FFF9"
    },
    "machine_closure": "SATISFIED",
    "next_milestone": "ARTICLE QUALITY BASELINE",
    "open_failure_families": [
      "FF-UC-001",
      "FF-IE-001",
      "FF-AG-001",
      "FF-SC-001",
      "FF-GA-001",
      "FF-EV-001"
    ],
    "production_acceptance": "NOT REACHED",
    "production_binding": "UNCHANGED",
    "ri5_protection": "PROTECTED_BASE"
  },
  "schema_version": "1.0",
  "snapshot_id": "SYNC-PUBLIC-APPLICABILITY-CONTRACT-CURRENTIZATION-20260927",
  "source_internal_commit_sha": "fa0abd4f17657bf306df0704b8595b171daa37b0",
  "source_sync_id": "CFG-20260927-001",
  "supersedes_snapshot_id": "SYNC-PUBLIC-BLOCK-CONTINUITY-CURRENTIZATION-20260926"
}
